card_name,perks_summary
Bank of America® Unlimited Cash Rewards Credit Card,"Visa Signature perks (extended warranty, travel & emergency assistance, ID Navigator), Museums on Us free admission first weekend each month, BankAmeriDeals merchant offers"
Bank of America® Travel Rewards Credit Card,"Free FICO Score monthly, no foreign transaction fees, straightforward redemption with no blackout dates, Preferred Rewards bonus up to 75%"
Bank of America® Premium Rewards® Credit Card,"Up to $100 airline incidental credit, up to $100 TSA PreCheck/Global Entry credit every four years, no foreign transaction fees"
Bank of America® Premium Rewards® Elite Credit Card,"Complimentary 24/7 concierge, up to $300 airline incidental credit, up to $150 lifestyle credit, Priority Pass Select lounge access, hotel perks (late checkout, breakfast, upgrades), Avis/Hertz/National/Audi discounts, travel protections"
Bank of America® Business Advantage Customized Cash Rewards,—
Bank of America® Business Advantage Unlimited Cash Rewards,"Travel & emergency services (travel accident insurance $100,000; auto rental insurance; emergency ticket replacement; lost-luggage assistance; legal & medical referrals), free Dun & Bradstreet business credit scores, extended warranty, zero liability, Balance Connect overdraft protection"
Bank of America® Business Advantage Travel Rewards,—
Alaska Airlines Visa® credit card,—
Alaska Airlines Visa® Business credit card,"Free checked bag for you and up to 6 guests; priority boarding; 20% back on in‑flight purchases; $100 off annual Alaska Lounge+ membership; annual Companion Fare (~$99 + taxes/fees) after spend; Visa Signature business protections (e.g., travel accident insurance, roadside dispatch, emergency services)"
Wells Fargo Active Cash® Card,"24/7 Visa Signature Concierge; access to special dining & entertainment offers; up to $600 cell phone protection (damage/theft, $25 deductible); My Wells Fargo Deals discounts"
Wells Fargo Autograph℠ Card,24/7 Visa Concierge; Visa Signature Luxury Hotel Collection perks; cell phone protection up to $600 ($25 deductible); My Wells Fargo Deals; Autograph Card Exclusives (ticket access)
Wells Fargo Reflect® Card,No perks listed (focus is on intro APR and no annual fee)
Wells Fargo Autograph Journey℠ Card,"Annual $50 airline statement credit; Autograph Card Exclusives (intimate concert ticket access); cell phone protection up to $1,000 (2 claims/year); My Wells Fargo Deals; Visa Signature Concierge; Visa Signature Luxury Hotel Collection"
Wells Fargo Business Platinum Credit Card,No perks listed (focus is on intro APR and no annual fee)
Discover it® Cash Back,Cashback Match at end of first year (dollar‑for‑dollar match of all cash back earned); free FICO score; $0 fraud liability; online privacy protection; identity alerts
Discover it® Miles,Unlimited first‑year Miles match; free FICO score; Social Security number alerts; Freeze It security; $0 fraud liability; flexible redemption
Discover it® Student Cash Back,"5% cash back on rotating categories (up to $1,500 per quarter, must activate), unlimited 1% on other purchases; unlimited Cashback Match at end of first year; $0 fraud liability; free SSN alerts; Freeze it® on/off switch"
Discover it® Student Chrome,"2% cash back at gas stations & restaurants (up to $1,000 per quarter), unlimited 1% on other purchases; unlimited Cashback Match at end of first year; free SSN alerts; Freeze it® on/off switch"
Discover it® Secured Credit Card,"5% cash back on two categories you choose each quarter (up to $2,000 combined), 2% on one everyday category, 1% on other purchases; zero fraud liability; contactless, mobile wallet, autopay, choose due date"
U.S. Bank Altitude® Reserve Visa Infinite® Card,4 free airport lounge visits + 4 free guest visits per year (Priority Pass); TSA PreCheck/Global Entry credit; travel & purchase protections (via Visa Infinite)
U.S. Bank Altitude® Go Visa Signature® Card,"4× points on dining/takeout/delivery (cap $2,000 per quarter starting Apr 14 2025), 2× on groceries, gas/EV charging, streaming; $15 annual streaming credit; auto rental CDW, roadside dispatch, travel & emergency assistance, extended warranty"
U.S. Bank Altitude® Connect Visa Signature® Card,"$30 annual streaming credit; up to $100 TSA PreCheck/Global Entry credit every 4 years; up to $600 cell phone protection; Priority Pass (4 free lounge visits/year); travel protections (trip cancel/interruption, delay, SmartDelay); no foreign transaction fees; contactless"
U.S. Bank Cash+® Visa Signature® Card,"Visa Signature perks: travel & emergency assistance, Luxury Hotel Collection upgrades; complimentary concierge service"
U.S. Bank Shopper Cash Rewards™ Visa Signature® Card,"Rewards Center Shopping Deals extra cash back; prepaid travel 5.5% back on hotel & car reservations; flexible redemption options (statement credit, rewards card, deposit)"
U.S. Bank Visa® Platinum Card,"Cell phone protection (up to $600 per claim, $1,200 per year), free TransUnion credit score access, Visa fraud protection, 0% intro APR on purchases and balance transfers (18 billing cycles), no annual fee"
Kroger Rewards World Elite Mastercard®,Access to free credit scores; discounts on purchases of goods and services (non‑travel); contactless payments; fee‑free foreign transactions
Harley‑Davidson® Visa® Card,"Special promotions and discounts on Harley‑Davidson parts, accessories and apparel; exclusive access to Harley‑Davidson events, rallies and private experiences"
U.S. Bank Triple Cash Rewards World Elite Mastercard® for Business,"Annual $100 software credit for recurring subscriptions (e.g., QuickBooks, FreshBooks); extended warranty; rental car coverage; travel & emergency assistance; no annual fee"
U.S. Bank Business Leverage® Visa Signature® Card,"Free TransUnion credit score access; FlexControl budgeting tools; free employee cards; Visa Signature benefits (auto rental CDW, extended warranty, travel accident, lost luggage, roadside dispatch, emergency services)"
JetBlue Card,"Free first checked bag for you (no companions); 50% inflight savings on food & drink; Points Payback for statement credits; no blackout dates; 10% points back after award flight; annual 5,000‑point bonus; earn tiles toward Mosaic"
JetBlue Plus Card,"Free first checked bag for you and up to 3 companions; 50% inflight savings; $100 annual JetBlue Vacations statement credit; Points Payback up to $1,000/year; 10% points back after award flight; annual 5,000‑point bonus; travel & purchase protections"
JetBlue Business Card,"Free first checked bag for you and up to 3 companions; 50% inflight savings; $100 annual JetBlue Vacations statement credit; 6× points on JetBlue, 2× at restaurants & office supplies; 5,000‑point anniversary bonus"
AAdvantage® Aviator® Red World Elite Mastercard®,"Free first checked bag for you and up to four companions; preferred boarding; up to $25 annual in‑flight Wi‑Fi credit; travel accident, trip cancellation/interruption, baggage delay insurance, auto rental CDW; anniversary companion certificate (domestic economy, $99 + taxes) after $20,000 spend"
AAdvantage® Aviator® World Elite Business Mastercard®,"Free first checked bag for you and up to four companions; preferred boarding; 25% statement credit on in‑flight food & beverage; annual companion certificate (domestic economy, $99 + taxes) after $30,000 spend; 5% anniversary mileage bonus; MileSAAver award discount; complimentary employee cards"
Wyndham Rewards® Earner℠ Card,"Automatic Wyndham Rewards Gold status (free Wi‑Fi, preferred room, late checkout); 10% fewer points needed for free nights; cardmember booking discount; 7,500 anniversary bonus points after $15,000 spend; no foreign transaction fees; 0% intro APR on balance transfers; unlimited earning"
Wyndham Rewards® Earner℠ Plus Card,"Automatic Wyndham Rewards Gold status; 10% fewer points for free nights; cardmember booking discount; 7,500 anniversary bonus points; no foreign transaction fees; 0% intro APR on balance transfers"
Wyndham Rewards® Earner℠ Business Card,"Automatic Wyndham Rewards Diamond status (suite upgrades, welcome amenity); 10% fewer points for free nights; cardmember booking discount; 15,000 anniversary bonus points; no foreign transaction fees; complimentary employee cards; Visa SavingsEdge"
Choice Privileges® Mastercard®,"Automatic Gold Elite status (10 elite night credits); exclusive member rates; Your Extras midweek benefits (e.g., Amazon, Starbucks, Uber credits, points, airline miles)"
Choice Privileges® Select Mastercard®,"Automatic Platinum Elite status; 20 elite night credits; room upgrades, late checkout; 30,000 anniversary bonus points; up to $120 Global Entry/TSA PreCheck credit; cell phone protection; no foreign transaction fees"
Carnival® World Mastercard®,FunPoints convert to new Carnival Rewards points when program launches June 2026; no other perks listed
Princess Cruises Rewards Visa® Card,"No foreign transaction fees; $0 fraud liability; Concierge service for dining, travel, hotels, entertainment; Free FICO® Score access; 0% intro APR on balance transfers; double points on Princess purchases; bonus points; travel & protection benefits"
TD Double Up℠ Credit Card,Visa Zero Liability; Digital wallet; Instant card replacement; Contactless payments; Cell phone protection; Emergency card replacement; ID Navigator; Roadside Dispatch®; Same‑day delivery; Sofar Sounds music; Visa offers and deals
TD Cash Credit Card,Switchable quarterly 3% and 2% cash back categories; 1% on other purchases; no annual fee; special offer; 0% intro APR on balance transfers and purchases
TD First Class℠ Visa Signature® Credit Card,Not found
TD Business Solutions Credit Card,Not found
PNC Cash Rewards® Visa® Credit Card,Cell phone protection; Zero Liability Fraud Protection; PNC Easy Lock®; Online account tools; Contactless technology; Online statements
PNC points® Visa® Credit Card,Not found
PNC Core® Visa® Credit Card,Not found
PNC Travel Rewards Visa® Credit Card,Cell phone protection when you pay your wireless bill; Zero Liability fraud protection
Truist Enjoy Cash,Loyalty Cash Bonus (10%–50%) when redeemed into Truist deposit account; Visa Zero Liability; customizable card controls; contactless payments
Truist Enjoy Travel,Up to $85 statement credit for TSA PreCheck® or Global Entry® every four years; Loyalty Travel Bonus (10%–50%); Visa Zero Liability; customizable controls; contactless payments
Truist Future Credit Card,Visa Zero Liability; customizable card controls; contactless payments
Truist Business Credit Card,Add authorized cardholders free; digital account management; accounting software integration; contactless payments; overdraft protection link; Visa Zero Liability
Citizens Cash Back Plus® World Mastercard®,"Flat 1.8% cash back on all purchases (1.9% with Citizens Quest checking); extended warranty protection; Mastercard World benefits (ID theft protection, lifestyle & travel services)"
Citizens Clear Value® Mastercard®,"No longer open to new applicants; flat 1.8% cash back; 0% intro APR on balance transfers; extended warranty, car rental insurance"
Citizens Bank World™ Elite Mastercard®,"Access to Priceless Experiences; Mastercard Golf; Transit Benefit; Lyft, Peacock, Instacart offers; ID Theft Protection; HealthLock; Zero Liability; concierge; Soho Friends; travel credits (Global Entry/TSA, Priority Pass, annual travel credits)"
Citizens Business Credit Card,Perks include: 24‑hour toll‑free live customer assistance; online account access 24/7; rental car collision damage waiver protection; and a host of Mastercard benefits.
Fifth Third 1% Cash/Back Credit Card,"Perks include: 0% introductory APR for 15 months on purchases and balance transfers; $0 annual fee; unlimited 1% cash back on every purchase (no caps, no expiration); no international transaction fees; contactless (touch‑free) payments; cell phone protection; ability to temporarily lock/unlock the card via mobile app; easy account management via online and mobile banking."
Fifth Third TRIO® Credit Card,"Perks include: 10,000 bonus points (worth $100) after spending $1,000 within 90 days; 3% cash back at restaurants and 2% cash back on gas, grocery, and drug store purchases (combined up to $1,500 per quarter); 1% cash back on all other purchases; 0% introductory APR on balance transfers for the first 12 billing cycles; no annual fee; no foreign transaction fees; cell phone protection; Mastercard benefits including ID theft protection, zero liability, travel services, airport concierge, and TPC Private Club access."
Fifth Third Preferred Cash/Back,"Perks include: unlimited 2% cash back on all purchases; no annual fee; no caps or expiration on rewards; contactless-enabled card; digital wallet-ready; ability to temporarily lock/unlock card via mobile app; no international transaction fees; cell phone protection; protection against unauthorized purchases (Mastercard ID Theft Protection and Zero Liability); travel support services including Mastercard Travel & Lifestyle, Airport Concierge, and Global Service."
Fifth Third Business Credit Card,"Perks include: complimentary employee cards; car rental insurance; purchase protection; price protection; extended warranty; baggage insurance; roadside assistance; travel assistance; trip cancellation/interruption protection; concierge service; flexible redemption options (travel, gas cards, merchandise, charity credits, cash back); no limits on earning or redeeming points; no blackout dates."
Key Cashback® Credit Card,"Perks include: unlimited 1%–2% cashback on all purchases (2% if you have a qualifying KeyBank checking account with 5+ monthly transactions, otherwise 1%) ; redeemable as statement credit or deposit to KeyBank checking or savings; access to your FICO® Score via KeyBank online/mobile; Mastercard World benefits including ID Theft Protection™, Zero Liability Protection, Master Rental® Coverage, and Mastercard Global Services™; contactless Tap & Go® technology; online & mobile banking features including card lock and account alerts."
Key2More Rewards® Credit Card,"Perks include: earn 5 points per $1 on eligible purchases with no caps; monthly bonus points (25% bonus for $1,000–$1,999 spend, 50% bonus for $2,000+ spend); redeem points for travel, shopping, event tickets, gift cards, cash back, merchandise, charity donations, event tickets; view FICO® Score for free; temporary lock security feature; Mastercard benefits including ID Theft Protection™, Zero Liability Protection, Master Rental Coverage, contactless Tap & Go®; online & mobile banking, account alerts."
Key Secured Credit Card,"• No annual fee
• Security deposit held in a Key Active Saver account (builds savings while building credit)
• Reports to the three major credit bureaus (Equifax, Experian, TransUnion)
• Quarterly reviews for potential graduation to an unsecured card
• Free access to FICO® Score anytime via online/mobile banking (does not impact credit score)
• Mastercard benefits including ID Theft Protection™ and Zero Liability Protection
• Contactless Tap & Go® technology
• Temporary lock/unlock feature via online/mobile banking"
KeyBank Business Rewards Credit Card,"Employee cards at no additional cost; Automatic Payments; Secure Online Business Banking; Fast, easy purchases (chip + contactless); Mastercard benefits: ID Theft Protection, Receipt Management, MasterRental insurance, business discounts"
Regions Prestige Visa® Signature® Credit Card,Access to Free Credit Scores; Automobile rental insurance; Extended warranty; Concierge service; Travel accident insurance; Lost luggage reimbursement; Roadside dispatch; Travel & emergency assistance; Purchase security; Fraud alerts; Visa Zero Liability; Regions LockIt®; Mobile wallet provisioning; Contactless payments
Regions Premium Visa® Signature® Credit Card,"Visa Signature perks: concierge service, baggage insurance, purchase protection, price protection, trip cancellation & interruption protection; $0 fraud liability"
Regions Explore Visa® Credit Card,Zero Liability Policy; Regions LockIt®; Refundable Security Deposit; Mobile Pay; Travel & Emergency Assistance; Auto Rental Collision Damage Waiver
Regions Business Enhanced Visa® Signature® Credit Card,Visa SavingsEdge
Huntington® Cashback Credit Card,Late Fee Grace®; No foreign fees; Card Lock; Free FICO® Credit Score; No Penalty Pricing; Contactless Payments; Authorized Users; Digital wallet access
Huntington® Voice Credit Card,Late Fee Grace®; No foreign fees; Card Lock; Free FICO® Credit Score; No Penalty Pricing; Contactless Payments; Authorized Users; Digital wallet access
Huntington® Business Credit Card,Employee cards and spend controls; Late Fee Grace®; No annual fee; No foreign transaction fees; Mastercard Zero Liability Protection; Mastercard ID Theft Protection™; Contactless payments; Digital wallet access
USAA® Preferred Cash Rewards Visa Signature®,Unlimited 1.5% cash back on all purchases; no annual fee; no foreign transaction fees; auto deductible reimbursement up to $200
USAA® Rate Advantage Visa® Platinum,"Extended warranty, purchase security, cell phone protection, travel insurance, concierge, no foreign transaction fees"
USAA® Rewards™ American Express® Card,"3× points on dining, 2× on gas & groceries, no annual fee, no foreign transaction fee, active‑duty APR reduction to 4%"
USAA® Cashback Rewards Plus American Express®,"5% cash back on gas & military base purchases (up to $3,000/year), 2% on groceries (up to $3,000/year), 1% on others; no annual fee; MemberShop portal; APR rebate for military campaigns"
USAA® Secured Visa® Platinum,"No perks listed (secured card, no rewards)"
Navy Federal cashRewards Credit Card,"Collision Damage Waiver, Visa Signature Concierge, emergency card replacement & cash, purchase security, roadside dispatch, discounts at hotels/resorts/cruise lines, free credit scores"
Navy Federal More Rewards American Express® Credit Card,"Up to 30% off hotels, up to 25% off car rentals + rental insurance, roadside assistance, entertainment presale access, no reward expiration"
Navy Federal Flagship Rewards Credit Card,"Free Amazon Prime annual membership, up to $120 Global Entry/TSA Pre✓® credit, travel & emergency assistance, no reward expiration"
Navy Federal Platinum Credit Card,"Not found (issuer site did not list perks such as discounts, free subscriptions, or private events)"
Navy Federal nRewards® Secured Credit Card,"Collision Damage Waiver on car rentals; standard Navy Federal card benefits (Zero Liability, fraud notifications, 24/7 US‑based service, ability to freeze card, access to credit score)"
Navy Federal GO BIZ™ Rewards,"Not found (issuer site did not list perks such as discounts, free subscriptions, or private events)"
PenFed Power Cash Rewards Visa Signature® Card,"Visa Signature benefits including Shipt free membership, Silvercar 10–15% discount, Avis/Budget up to 25% off and upgrades, Sonoma County wine perks, emergency card replacement, emergency cash disbursement, NortonLifeLock ID Navigator"
PenFed Platinum Rewards Visa Signature® Card,"Cell phone protection; member‑only discounts on food, wine, shopping, sports, hotels, car rentals, entertainment; access to Luxury Hotel Collection; travel accident coverage; complimentary concierge service"
PenFed Pathfinder® Rewards Visa Signature® Card,"Annual $100 domestic ancillary air travel credit; Global Entry or TSA PreCheck fee reimbursement; annual Priority Pass lounge membership; travel protections (auto‑rental insurance, trip‑delay reimbursement)"
PenFed Gold Visa® Card,"Not found (issuer site did not list perks such as discounts, free subscriptions, or private events)"
PenFed Business Rewards Visa®,"Not found (issuer site did not list perks such as discounts, free subscriptions, or private events)"
BECU Cash Back Visa®,"Perks include: Price Protection (refund up to $500 per item, up to $2,500 per year); Extended Warranty Protection; Baggage Delay Protection (up to $100/day, max $300); Lost Luggage Reimbursement (up to $1,250); Trip Cancellation/Trip Interruption coverage (up to $2,000); Worldwide Automatic Travel Accident Insurance (up to $500,000); Emergency assistance services including roadside dispatch, travel and emergency assistance, translation, prescription assistance; Visa Account Updater; ID Navigator identity theft protection (dark web monitoring, breach notifications, stolen wallet assist, one‑bureau credit monitoring, account freezes, restoration assist)."
BECU Low Rate Credit Card,Travel and emergency assistance services; Worldwide automatic travel accident insurance; Roadside dispatch; Extended warranty protection; Credit card fraud alerts; NortonLifeLock ID Navigator identity theft monitoring; Contactless tap technology; EMV security chip; Visa Account Updater
DCU Visa® Platinum Rewards,"Perks include: 1 point per $1 spent redeemable for travel, merchandise, gift cards; no annual fee; no foreign transaction fees; low interest rates on purchases, balance transfers, and cash advances; EMV chip security; fraud monitoring and ability to lock card via mobile app; mobile banking for tracking points, balances, payments."
DCU Visa® Platinum,"• No annual fee
• No balance transfer fee
• No foreign transaction fee
• No cash advance fee
• Fraud notifications and ability to freeze/unfreeze card
• Tap-to-Pay functionality
• Extended warranty protection
• Travel accident insurance
• Complimentary Shipt membership (free delivery on orders of $35+, enrollment required)
• Sofar Sounds live music presale access and free ticket offers
• Free monthly FICO® Score access (Equifax-based)"
Amazon Store Card,• 5% back on Amazon.com purchases for Prime members (no cash-back for non‑Prime) • Option for special financing (0% APR equal monthly payments or deferred interest) on purchases $150+ (6–24 months depending on amount) • Zero fraud liability • Shop with Points: redeem rewards points via Amazon Pay at participating merchants (1 point = $1)
PayPal Cashback Mastercard®,"Perks include: unlimited 3% cash back on purchases made through PayPal; unlimited 1.5% cash back on all other purchases where Mastercard is accepted; ability to combine merchant cash back offers via the PayPal app; Mastercard ID Theft Protection™; contactless payments via mobile wallets (Apple Pay, Google Pay, Samsung Pay); microchip technology; standard Mastercard benefits such as extended warranty coverage, price protection, identity theft resolution assistance."
PayPal Extras Mastercard®,"Perks include: 3 points per dollar on gas and restaurant purchases; 2 points per dollar on PayPal and eBay purchases; 1 point per dollar on all other purchases; redemption options for gift cards (from 800 points), merchandise (from 3,000 points), cash back to PayPal or bank/debit card (6,000 points for $50), and travel vouchers (15,000 points) with restrictions; standard Mastercard benefits such as identity‑theft protection and airport concierge discounts; zero liability for unauthorized charges."
Sam’s Club® Mastercard®,"Perks include:
• 5% back on gas (up to $6,000 per year, then 1%)
• 3% back on dining and takeout
• 3% back on Sam’s Club purchases for Plus members (1% for Club members)
• Doubles as your Sam’s Club membership card
• No annual fee (aside from required Sam’s Club membership)
• No foreign transaction fees
• Rewards automatically loaded as Sam’s Cash onto membership card, redeemable in-club or online
• Contact‑free payments via Scan & Go integration
• Mobile app account management (track spending, freeze account, etc.)"
Lowe’s Advantage Card,"5% off eligible purchases every day; 20% off first qualifying purchase (up to $100); special financing (e.g., 6‑month deferred interest on $299+; fixed payments 84 mo at 9.99% APR on $2,000+); access to exclusive limited‑time offers and events; free member gifts, DIY‑U workshops, free shipping tiers via MyLowe’s Rewards program"
Lowe’s Business Rewards Card,"5% cash back at Lowe’s for first 6 months (then 2%); 2% back at U.S. restaurants, office supply stores, wireless providers; secondary rental car insurance; purchase protection and extended warranty"
eBay Mastercard®,"5× points on eBay after $1,000 spend/year; 3× points on eBay until then; 2× on gas, restaurants, groceries; 1× on other purchases; Mastercard benefits: Identity Theft Resolution, Zero‑Liability, Priceless Cities special‑access events"
Chevron and Texaco Techron Advantage™ Card,Instant fuel discounts at pump or statement credits; new cardholders: 62¢/gal for first 30 days; up to 65¢/gal ongoing; Visa version: extra up to 10¢/gal via non‑fuel spend; no annual fee; $0 fraud liability; 24/7 ATM access; cell phone protection; Synchrony Car Care acceptance and 6‑month promo financing on $199+
BPme Rewards Visa®,"15¢/gal off after first 60 days (50¢/gal first 60 days intro); 5× points on non‑fuel at bp/Amoco; 3× on dining and groceries; 1× on other purchases; redeem for cash back, gift cards; no annual fee"
Gap Good Rewards Visa®,"5 points per $1 at Gap, Old Navy, Banana Republic, Athleta; 1 point elsewhere; 20% off first purchase + free shipping; extra 10% off at Gap/Outlet/Factory; special events, birthday gift, exclusive discounts, free returns, free shipping $50+; Silver status perks: 20% quarterly bonus points, choose‑your‑own sale day, free alterations, priority hotline"
